And though thrice Wreck"t , ? s no Wiser than he went .	Sadness	Sadness

Again , I see , the Heavenly Fair despis "d ,	Annoyance --- Sadness	Sadness --- Uneasiness
A Hagg like Hell , with Gold , more highly priz "d ;	Annoyance --- Sadness	Sadness --- Uneasiness
Mens Faith betray "d , their Prince and Country Sold ,	Annoyance --- Sadness	Sadness --- Uneasiness
Their God deny "d , all for the Idol Gold .	Annoyance --- Sadness	Sadness --- Uneasiness

Unhappy Wretch , who first found out the Oar ,	Annoyance	Uneasiness --- Annoyance
What kind of Vengeance rests for thee in store ?	Annoyance	Uneasiness --- Annoyance
If Nebats Son , that Israel led astray ,	Annoyance	Uneasiness --- Annoyance
Meet a severe Reward at the last Day ?	Annoyance	Uneasiness --- Annoyance
Some strange unheard-of Judgement thou wilt find ,	Annoyance	Uneasiness --- Annoyance
Who thus hast caus "d to Sin all Humane Kind .	Annoyance	Uneasiness --- Annoyance


Love , the Soul of Poetry .		

When first Alexis did in Verse delight ,	Beauty / Joy	Beauty / Joy
His Muse in Low , but Graceful Numbers walk"t ,	Beauty / Joy	Beauty / Joy
And now and then a little Proudly stalk"t ;	Beauty / Joy	Beauty / Joy
But never aim "d at any noble Flight :	Beauty / Joy	Beauty / Joy
The Herds , the Groves , the gentle purling Streams ,	Beauty / Joy	Beauty / Joy
Adorn "d his Song , and were his highest Theams .	Beauty / Joy	Beauty / Joy

But Love these Thoughts , like Mists , did soon disperse ,	Beauty / Joy	Beauty / Joy
Enlarg "d his Fancy , and set free his Muse ,	Beauty / Joy	Beauty / Joy
Biding him more Illustrious Subjects choose ;	Beauty / Joy	Beauty / Joy
The Acts of Gods , and God-like Men reherse .	Beauty / Joy	Beauty / Joy
From thence new Raptures did his Breast inspire ,	Beauty / Joy	Beauty / Joy
His scarce Warm-Heart converted was to Fire .	Beauty / Joy	Beauty / Joy

Th ? exalted Poet rais "d by this new Flame ,	Awe / Sublime --- Beauty / Joy	Beauty / Joy --- Awe / Sublime
With Vigor flys , where late he crept along ,	Awe / Sublime --- Beauty / Joy	Beauty / Joy --- Awe / Sublime
And Acts Divine , in a Diviner Song ,	Awe / Sublime --- Beauty / Joy	Beauty / Joy --- Awe / Sublime
Commits to the eternal Trompe of Fame .	Awe / Sublime --- Beauty / Joy	Beauty / Joy --- Awe / Sublime
And thus Alexis does prove Love to be ,	Awe / Sublime --- Beauty / Joy	Beauty / Joy --- Awe / Sublime
As the Worlds Soul , the Soul of Poetry .	Awe / Sublime --- Beauty / Joy	Beauty / Joy --- Awe / Sublime


SUCCESS		

Success is counted sweetest	Beauty / Joy	Beauty / Joy
By those who ne"er succeed .	Beauty / Joy	Beauty / Joy
To comprehend a nectar	Beauty / Joy	Beauty / Joy
Requires sorest need .	Beauty / Joy	Beauty / Joy

Not one of all the purple host	Sadness	Sadness
Who took the flag to-day	Sadness	Sadness
Can tell the definition ,	Sadness	Sadness
So clear , of victory ,	Sadness	Sadness

As he , defeated , dying ,	Sadness	Sadness
On whose forbidden ear	Sadness	Sadness
The distant strains of triumph	Sadness	Sadness
Break , agonized and clear !	Sadness	Sadness


I felt a funeral in my brain		

I felt a funeral in my brain ,	Sadness	Sadness
And mourners , to and fro ,	Sadness	Sadness
Kept treading , treading , till it seemed	Sadness --- Awe / Sublime	Sadness
That sense was breaking through .	Sadness --- Awe / Sublime	Sadness

And when they all were seated ,	Sadness	Sadness
A service like a drum	Sadness	Sadness
Kept beating , beating , till I thought	Sadness	Sadness
My mind was going numb .	Sadness	Sadness

And then I heard them lift a box ,	Sadness	Sadness
And creak across my soul	Sadness	Sadness
With those same boots of lead , again .	Sadness	Sadness
Then space began to toll	Sadness	Sadness

As all the heavens were a bell ,	Awe / Sublime	Sadness --- Awe / Sublime
And Being but an ear ,	Awe / Sublime	Sadness --- Awe / Sublime
And I and silence some strange race ,	Awe / Sublime --- Sadness	Sadness --- Awe / Sublime
Wrecked , solitary , here .	Awe / Sublime --- Sadness	Sadness --- Awe / Sublime

And then a Plank in Reason, broke,	Awe / Sublime	Sadness --- Awe / Sublime
And I dropped down, and down -	Awe / Sublime	Sadness --- Awe / Sublime
And hit a World, at every plunge,	Awe / Sublime	Sadness --- Awe / Sublime
And Finished knowing - then -	Awe / Sublime	Sadness --- Awe / Sublime


On His Blindness		

WHEN I consider how my light is spent	Suspense	Sadness --- Suspense
Ere half my days in this dark world and wide,	Suspense	Sadness --- Suspense
And that one Talent which is death to hide	Sadness	Sadness --- Suspense
Lodged with me useless, though my soul more bent	Sadness	Sadness --- Suspense

To serve therewith my Maker, and present	Vitality	Vitality
My true account, lest He returning chide,	Vitality	Vitality
?Doth God exact day-labour, light denied??	Vitality	Vitality
I fondly ask.	Vitality	Vitality
But Patience, to prevent	Vitality	Vitality

That murmur, soon replies, ?God doth not need	Awe / Sublime	Sadness --- Awe / Sublime
Either man?s work or his own gifts.	Awe / Sublime	Sadness --- Awe / Sublime
Who best	Awe / Sublime	Sadness --- Awe / Sublime
Bear his mild yoke, they serve him best.	Awe / Sublime	Sadness --- Awe / Sublime
His state	Awe / Sublime	Sadness --- Awe / Sublime

Is kingly: thousands at his bidding speed,	Beauty / Joy	Beauty / Joy --- Awe / Sublime
And post o?er land and ocean without rest;	Beauty / Joy	Beauty / Joy --- Awe / Sublime
They also serve who only stand and wait.?	Beauty / Joy	Beauty / Joy --- Awe / Sublime


On His Being Arrived to the Age of Twenty-Three?		

HOW soon hath Time, the subtle thief of youth,	Sadness	Sadness
Stolen on his wing my three and twentieth year!	Sadness	Sadness
My hasting days fly on with full career,	Vitality	Vitality
But my late spring no bud or blossom shew?th.	Vitality	Vitality
Perhaps my semblance might deceive the truth,	Vitality	Vitality
That I to manhood am arrived so near,	Vitality	Vitality
And inward ripeness doth much less appear,	Vitality	Vitality
That some more timely-happy spirits indu?th.	Vitality	Vitality
Yet be it less or more, or soon or slow,	Vitality	Vitality
It shall be still in strictest measure even	Vitality	Vitality
To that same lot, however mean or high,	Vitality --- Awe / Sublime	Vitality
Toward which Time leads me, and the will of Heaven,	Vitality --- Awe / Sublime	Vitality --- Awe / Sublime
All is, if I have grace to use it so,	Vitality --- Awe / Sublime	Vitality --- Awe / Sublime
As ever in my great Task-master?s eye	Vitality --- Awe / Sublime	Vitality --- Awe / Sublime


Mowing		

THERE was never a sound beside the wood but one ,	Beauty / Joy --- Suspense	Suspense --- Beauty / Joy
And that was my long scythe whispering to the ground .	Beauty / Joy --- Suspense	Suspense --- Beauty / Joy
What was it it whispered ?	Beauty / Joy --- Suspense	Beauty / Joy --- Suspense
I knew not well myself ;	Beauty / Joy --- Suspense	Beauty / Joy --- Suspense
Perhaps it was something about the heat of the sun ,	Beauty / Joy --- Suspense	Beauty / Joy
Something , perhaps , about the lack of sound ?	Beauty / Joy --- Suspense	Beauty / Joy
And that was why it whispered and did not speak .	Beauty / Joy	Beauty / Joy
It was no dream of the gift of idle hours ,	Beauty / Joy	Beauty / Joy
Or easy gold at the hand of fay or elf :	Beauty / Joy	Beauty / Joy
Anything more than the truth would have seemed too weak	Beauty / Joy	Beauty / Joy
To the earnest love that laid the swale in rows ,	Beauty / Joy	Beauty / Joy
Not without feeble-pointed spikes of flowers	Beauty / Joy	Beauty / Joy
( Pale orchises ) , and scared a bright green snake .	Beauty / Joy	Beauty / Joy
The fact is the sweetest dream that labor knows .	Beauty / Joy	Beauty / Joy
My long scythe whispered and left the hay to make .	Beauty / Joy	Beauty / Joy


Fire and Ice		

Some say the world will end in fire,	Awe / Sublime	Awe / Sublime
Some say in ice.	Awe / Sublime	Awe / Sublime
From what I?ve tasted of desire	Humor	Awe / Sublime --- Humor
I hold with those who favor fire.	Humor	Awe / Sublime --- Humor
But if it had to perish twice,	Humor	Awe / Sublime --- Humor
I think I know enough of hate	Humor	Awe / Sublime --- Humor
To say that for destruction ice	Humor	Awe / Sublime --- Humor
Is also great	Humor	Awe / Sublime --- Humor
And would suffice.	Humor	Awe / Sublime --- Humor


I Hear America Singing		

I hear America singing , the varied carols I hear ,	Beauty / Joy --- Vitality	Vitality --- Beauty / Joy
Those of mechanics , each one singing his as it should be blithe and strong ,	Beauty / Joy --- Vitality	Vitality --- Beauty / Joy
The carpenter singing his as he measures his plank or beam ,	Beauty / Joy --- Vitality	Vitality --- Beauty / Joy
The mason singing his as he makes ready for work , or leaves off work ,	Beauty / Joy --- Vitality	Vitality --- Beauty / Joy
The boatman singing what belongs to him in his boat , the deckhand	Beauty / Joy --- Vitality	Vitality --- Beauty / Joy
singing on the steamboat deck ,	Beauty / Joy --- Vitality	Vitality --- Beauty / Joy
The shoemaker singing as he sits on his bench , the hatter singing as	Beauty / Joy --- Vitality	Vitality --- Beauty / Joy
he stands ,	Beauty / Joy --- Vitality	Vitality --- Beauty / Joy
The wood-cutter "s song , the ploughboy "s on his way in the morning ,	Beauty / Joy --- Vitality	Vitality --- Beauty / Joy
or at noon intermission or at sundown ,	Beauty / Joy --- Vitality	Vitality --- Beauty / Joy
The delicious singing of the mother , or of the young wife at work ,	Beauty / Joy --- Vitality	Vitality --- Beauty / Joy
or of the girl sewing or washing ,	Beauty / Joy --- Vitality	Vitality --- Beauty / Joy
Each singing what belongs to him or her and to none else ,	Beauty / Joy --- Vitality	Vitality --- Beauty / Joy
The day what belongs to the day ? at night the party of young	Beauty / Joy --- Vitality	Vitality --- Beauty / Joy
fellows , robust , friendly ,	Beauty / Joy --- Vitality	Vitality --- Beauty / Joy
Singing with open mouths their strong melodious songs .	Beauty / Joy --- Vitality	Vitality --- Beauty / Joy


O Captain! My Captain!		

O Captain!	Beauty / Joy	Beauty / Joy
my Captain!	Beauty / Joy	Beauty / Joy
our fearful trip is done,	Beauty / Joy	Beauty / Joy
The ship has weather?d every rack, the prize we sought is won,	Beauty / Joy	Beauty / Joy
The port is near, the bells I hear, the people all exulting,	Beauty / Joy	Beauty / Joy
While follow eyes the steady keel, the vessel grim and daring;	Beauty / Joy	Beauty / Joy
But O heart!	Sadness	Sadness
heart!	Sadness	Sadness
heart!	Sadness	Sadness
O the bleeding drops of red,	Sadness	Sadness
Where on the deck my Captain lies,	Sadness	Sadness
Fallen cold and dead.	Sadness	Sadness

O Captain!	Vitality	Vitality
my Captain!	Vitality	Vitality
rise up and hear the bells;	Vitality	Vitality
Rise up?for you the flag is flung?for you the bugle trills,	Vitality	Vitality
For you bouquets and ribbon?d wreaths?for you the shores a-crowding,	Vitality	Vitality
For you they call, the swaying mass, their eager faces turning;	Vitality	Vitality
Here Captain!	Vitality	Vitality
dear father!	Vitality	Vitality
This arm beneath your head!	Vitality	Vitality
It is some dream that on the deck,	Sadness	Sadness
You?ve fallen cold and dead.	Sadness	Sadness

My Captain does not answer, his lips are pale and still,	Sadness	Sadness
My father does not feel my arm, he has no pulse nor will,	Sadness	Sadness
The ship is anchor?d safe and sound, its voyage closed and done,	Vitality	Sadness --- Vitality
From fearful trip the victor ship comes in with object won;	Vitality	Sadness --- Vitality
Exult O shores, and ring O bells!	Vitality	Sadness --- Vitality
But I with mournful tread,	Sadness	Sadness
Walk the deck my Captain lies,	Sadness	Sadness
Fallen cold and dead.	Sadness	Sadness


DANSE RUSSE		

If I when my wife is sleeping	Suspense	Suspense
and the baby and Kathleen	Suspense	Suspense
are sleeping	Suspense	Suspense
and the sun is a flame-white disc	Suspense	Suspense
in silken mists above shining trees ,?	Suspense	Suspense
if I in my north room	Suspense --- Humor	Suspense
danse naked , grotesquely	Suspense --- Humor	Suspense
before my mirror	Suspense --- Humor	Suspense
waving my shirt round my head	Suspense --- Humor	Suspense
and singing softly to myself :	Suspense --- Humor	Suspense
?I am lonely, lonely.	Humor	Humor
I was born to be lonely .	Humor	Humor
I am best so !?	Humor	Humor
If I admire my arms , my face,	Humor	Humor
my shoulders , flanks , buttocks	Humor	Humor
against the yellow drawn shades ,?	Humor	Humor

who shall say I am not	Humor	Humor
the happy genius of my household ?	Humor	Humor


To Waken an Old Lady		

OLD age is	Beauty / Joy	Suspense --- Beauty / Joy
a flight of small	Beauty / Joy	Suspense --- Beauty / Joy
cheeping birds	Beauty / Joy	Suspense --- Beauty / Joy
skimming	Beauty / Joy	Suspense --- Beauty / Joy
bare trees above a snow glaze.	Beauty / Joy	Suspense --- Beauty / Joy
Gaining and failing	Suspense --- Beauty / Joy	Beauty / Joy --- Suspense
they are buffeted	Suspense --- Beauty / Joy	Beauty / Joy --- Suspense
by a dark wind--	Suspense --- Beauty / Joy	Beauty / Joy --- Suspense
But what?	Suspense --- Beauty / Joy	Suspense --- Beauty / Joy
On harsh weedstalks	Beauty / Joy	Suspense --- Beauty / Joy
the flock has rested,	Beauty / Joy	Suspense --- Beauty / Joy
the snow	Beauty / Joy	Suspense --- Beauty / Joy
is covered with broken	Beauty / Joy	Suspense --- Beauty / Joy
seedhusks	Beauty / Joy	Suspense --- Beauty / Joy
and the wind tempered	Beauty / Joy	Suspense --- Beauty / Joy
by a shrill	Beauty / Joy	Suspense --- Beauty / Joy
piping of plenty.	Beauty / Joy	Suspense --- Beauty / Joy


My Love Is Like To Ice		

My love is like to ice, and I to fire:	Beauty / Joy	Beauty / Joy
How comes it then that this her cold so great	Sadness	Sadness
Is not dissolved through my so hot desire,	Sadness	Sadness
But harder grows the more I her entreat?	Sadness	Sadness
Or how comes it that my exceeding heat	Sadness	Sadness
Is not allayed by her heart-frozen cold,	Sadness	Sadness
But that I burn much more in boiling sweat,	Sadness	Sadness
And feel my flames augmented manifold?	Sadness	Sadness
What more miraculous thing may be told,	Beauty / Joy	Beauty / Joy
That fire, which all things melts, should harden ice,	Beauty / Joy	Beauty / Joy
And ice, which is congeal"s with senseless cold,	Beauty / Joy	Beauty / Joy
Should kindle fire by wonderful device?	Beauty / Joy	Beauty / Joy
Such is the power of love in gentle mind,	Awe / Sublime	Beauty / Joy --- Awe / Sublime
That it can alter all the course of kind.	Awe / Sublime	Beauty / Joy --- Awe / Sublime


Sonnet 54		

Of this worlds theatre in which we stay,	Beauty / Joy	Beauty / Joy
My love like the spectator ydly sits	Beauty / Joy	Beauty / Joy
Beholding me that all the pageants play,	Beauty / Joy	Beauty / Joy
Disguysing diversly my troubled wits.	Beauty / Joy	Beauty / Joy
Sometimes I joy when glad occasion fits,	Beauty / Joy	Beauty / Joy
And mask in myrth lyke to a comedy:	Beauty / Joy	Beauty / Joy
Soone after when my joy to sorrow flits,	Sadness	Sadness
I waile and make my woes a tragedy.	Sadness	Sadness
Yet she, beholding me with constant eye,	Sadness	Sadness
Delights not in my merth nor rues my smart:	Sadness	Sadness
But when I laugh she mocks, and when I cry	Sadness	Sadness
She laughs and hardens evermore her heart.	Sadness	Sadness
What then can move her?	Sadness	Sadness
if nor merth nor mone,	Sadness	Sadness
She is no woman, but a senceless stone.	Sadness	Sadness


ODE ON SOLITUDE		

Happy the man whose wish and care	Beauty / Joy	Beauty / Joy
A few paternal acres bound ,	Beauty / Joy	Beauty / Joy
Content to breathe his native air ,	Beauty / Joy	Beauty / Joy
In his own ground .	Beauty / Joy	Beauty / Joy

Whose herds with milk , whose fields with bread ,	Beauty / Joy	Beauty / Joy
Whose flocks supply him with attire ,	Beauty / Joy	Beauty / Joy
Whose trees in summer yield him shade ,	Beauty / Joy	Beauty / Joy
In winter fire .	Beauty / Joy	Beauty / Joy

Blest , who can unconcern"dly find	Beauty / Joy	Beauty / Joy
Hours , days , and years slide soft away ,	Beauty / Joy	Beauty / Joy
In health of body , peace of mind ,	Beauty / Joy	Beauty / Joy
Quiet by day ,	Beauty / Joy	Beauty / Joy

Sound sleep by night ; study and ease ,	Beauty / Joy	Beauty / Joy
Together mixt ; sweet recreation ;	Beauty / Joy	Beauty / Joy
And Innocence , which most does please	Beauty / Joy	Beauty / Joy
With meditation .	Beauty / Joy	Beauty / Joy

Thus let me live , unseen , unknown ,	Awe / Sublime	Vitality
Thus unlamented let me die ,	Awe / Sublime	Vitality
Steal from the world , and not a stone	Awe / Sublime	Vitality
Tell where I lie .	Awe / Sublime	Vitality


dying is fine)but Death		

?	Suspense	Suspense --- Humor
o	Suspense	Suspense --- Humor
baby	Suspense	Suspense --- Humor
i	Suspense	Suspense --- Humor

wouldn"t like	Suspense	Suspense --- Humor

Death if Death	Humor	Suspense --- Humor
were	Humor	Suspense --- Humor
good:for	Humor	Suspense --- Humor

when(instead of stopping to think)you	Humor	Suspense --- Humor

begin to feel of it,dying	Humor	Suspense --- Humor
"s miraculous	Humor	Suspense --- Humor
why?	Humor	Suspense --- Humor
be	Humor	Suspense --- Humor

cause dying is	Humor	Suspense --- Humor

perfectly natural;perfectly	Humor	Suspense --- Humor
putting	Humor	Suspense --- Humor
it mildly lively(but	Humor	Suspense --- Humor

Death	Humor	Suspense --- Humor

is strictly	Humor	Suspense --- Humor
scientific	Humor	Suspense --- Humor
&amp; artificial &amp;	Humor	Suspense --- Humor

evil &amp; legal)	Humor	Suspense --- Humor

we thank thee	Humor	Suspense --- Humor
god	Humor	Suspense --- Humor
almighty for dying	Humor	Suspense --- Humor
(forgive us,o life!	Humor	Suspense --- Humor
the sin of Death	Humor	Suspense --- Humor


[i carry your heart with me(i carry it in]		

i carry your heart with me(i carry it in	Beauty / Joy	Beauty / Joy
my heart)i am never without it(anywhere	Beauty / Joy	Beauty / Joy
i go you go,my dear;and whatever is done	Beauty / Joy	Beauty / Joy
by only me is your doing,my darling)	Beauty / Joy	Beauty / Joy
                                 i fear	Beauty / Joy	Beauty / Joy

no fate(for you are my fate,my sweet)i want	Beauty / Joy	Beauty / Joy
no world(for beautiful you are my world,my true)	Beauty / Joy	Beauty / Joy
and it?s you are whatever a moon has always meant	Beauty / Joy	Beauty / Joy
and whatever a sun will always sing is you	Beauty / Joy	Beauty / Joy

here is the deepest secret nobody knows	Beauty / Joy	Beauty / Joy
(here is the root of the root and the bud of the bud	Beauty / Joy	Beauty / Joy
and the sky of the sky of a tree called life;which grows	Beauty / Joy	Beauty / Joy
higher than soul can hope or mind can hide)	Beauty / Joy	Beauty / Joy
and this is the wonder that"s keeping the stars apart	Beauty / Joy	Beauty / Joy

i carry your heart(i carry it in my heart)	Beauty / Joy	Beauty / Joy


THE DESCENT OF DULLNESS		

In vain , in vain ? the all-composing Hour	Suspense	Suspense
Resistless falls : the Muse obeys the Pow"r .	Suspense	Suspense
She comes !	Suspense	Suspense
she comes !	Suspense	Suspense
the sable Throne behold	Suspense	Suspense
Of Night primval and of Chaos old !	Suspense	Suspense
Before her , Fancy "s gilded clouds decay ,	Sadness	Uneasiness
And all its varying Rain-bows die away .	Sadness	Uneasiness
Wit shoots in vain its momentary fires ,	Sadness	Uneasiness
The meteor drops , and in a flash expires .	Sadness	Uneasiness
As one by one , at dread Medea "s strain ,	Uneasiness	Uneasiness
The sick"ning stars fade off th ? ethereal plain ;	Uneasiness	Uneasiness
As Argus ? eyes by Hermes ? wand opprest ,	Uneasiness	Uneasiness
Clos "d one by one to everlasting rest ;	Uneasiness	Uneasiness
Thus at her felt approach , and secret might ,	Uneasiness	Uneasiness
Art after Art goes out , and all is Night .	Uneasiness	Uneasiness
See skulking Truth to her old cavern fled ,	Uneasiness	Sadness
Mountains of Casuistry heap "d o"er her head !	Uneasiness	Sadness
Philosophy , that lean "d on Heav"n before ,	Uneasiness	Sadness
Shrinks to her second cause , and is no more .	Uneasiness	Sadness
Physic of Metaphysic begs defence ,	Uneasiness	Sadness
And Metaphysic calls for aid on Sense !	Uneasiness	Sadness
See Mystery to Mathematics fly !	Uneasiness	Sadness
In vain !	Sadness --- Uneasiness	Sadness
they gaze , turn giddy , rave , and die .	Sadness --- Uneasiness	Sadness
Religion blushing veils her sacred fires ,	Sadness --- Uneasiness	Sadness
And unawares Morality expires .	Sadness --- Uneasiness	Sadness
For public Flame , nor private , dares to shine ;	Sadness --- Uneasiness	Sadness
Nor human Spark is left , nor Glimpse divine !	Sadness --- Uneasiness	Sadness
Lo !	Sadness --- Uneasiness	Uneasiness
thy dread Empire , CHAOS !	Sadness --- Uneasiness	Uneasiness
is restor "d ;	Sadness --- Uneasiness	Uneasiness
Light dies before thy uncreating word ;	Sadness --- Uneasiness	Uneasiness
Thy hand , great Anarch !	Sadness --- Uneasiness	Uneasiness
lets the curtain fall ,	Sadness --- Uneasiness	Uneasiness
And universal Darkness buries All .	Sadness --- Uneasiness	Uneasiness


I "m nobody ! Who are you ?		

I "m nobody !	Humor	Humor
Who are you ?	Humor	Humor
Are you nobody , too ?	Humor	Humor
Then there ? s a pair of us	Humor	Humor
? do n"t tell !	Humor	Humor
They ? d banish us , you know .	Humor	Humor

How dreary to be somebody !	Humor --- Sadness	Humor
How public , like a frog	Humor --- Sadness	Humor
To tell your name the livelong day	Humor --- Sadness	Humor
To an admiring bog !	Humor --- Sadness	Humor


The Flea		

Marke but this flea , and marke in this ,	Humor --- Beauty / Joy	Humor
How little that which thou deny"st me is ;	Humor --- Beauty / Joy	Humor
It suck "d me first , and now sucks thee ,	Humor --- Beauty / Joy	Humor
And in this flea , our two bloods mingled bee ;	Humor --- Beauty / Joy	Humor
Thou know"st that this cannot be said	Humor --- Beauty / Joy	Humor
A sinne , nor shame , nor losse of maidenhead ,	Humor --- Beauty / Joy	Humor
Yet this enjoyes before it wooe ,	Humor --- Beauty / Joy	Humor
And pamper "d swells with one blood made of two ,	Humor --- Beauty / Joy	Humor
And this , alas , is more then wee would doe .	Humor --- Beauty / Joy	Humor

Oh stay , three lives in one flea spare ,	Beauty / Joy	Humor
Where wee almost , yea more then maryed are .	Beauty / Joy	Humor
This flea is you and I , and this	Beauty / Joy	Humor
Our mariage bed , and mariage temple is ;	Beauty / Joy	Humor
Though parents grudge , and you , w"are met ,	Beauty / Joy	Uneasiness
And cloysterd in these living walls of Jet .	Beauty / Joy	Uneasiness
Though use make you apt to kill mee ,	Humor	Uneasiness
Let not to that , selfe murder added bee ,	Humor	Uneasiness
And sacrilege , three sinnes in killing three .	Humor	Uneasiness

Cruell and sodaine , hast thou since	Sadness	Uneasiness
Purpled thy naile , in blood of innocence ?	Sadness	Uneasiness
Wherein could this flea guilty bee ,	Sadness	Uneasiness
Except in that drop which it suckt from thee ?	Sadness	Uneasiness
Yet thou triumph"st , and saist that thou	Sadness	Uneasiness
Find"st not thy selfe , nor mee the weaker now ;	Sadness	Uneasiness
? Tis true , then learne how false , feares bee ; 25	Sadness	Uneasiness
Just so much honor , when thou yeeld"st to mee ,	Sadness	Uneasiness
Will wast , as this flea "s death tooke life from thee .	Sadness	Uneasiness


Song on May Morning		

NOW the bright morning-star, Day?s harbinger,	Beauty / Joy --- Vitality	Beauty / Joy
Comes dancing from the East, and leads with her	Beauty / Joy --- Vitality	Beauty / Joy
The flowery May, who from her green lap throws	Beauty / Joy --- Vitality	Beauty / Joy
The yellow cowslip and the pale primrose.	Beauty / Joy --- Vitality	Beauty / Joy
Hail, bounteous May, that dost inspire	Beauty / Joy --- Vitality	Beauty / Joy
Mirth, and youth, and warm desire!	Beauty / Joy --- Vitality	Beauty / Joy
Woods and groves are of thy dressing;	Beauty / Joy --- Vitality	Beauty / Joy
Hill and dale doth boast thy blessing.	Beauty / Joy --- Vitality	Beauty / Joy
Thus we salute thee with our early song,	Beauty / Joy --- Vitality	Beauty / Joy
And welcome thee, and wish thee long.	Beauty / Joy --- Vitality	Beauty / Joy


OZYMANDIAS		

I met a traveller from an antique land	Suspense	Suspense
Who said : Two vast and trunkless legs of stone	Suspense	Suspense
Stand in the desert ...	Uneasiness --- Suspense	Suspense
Near them , on the sand ,	Uneasiness --- Suspense	Suspense
Half sunk , a shattered visage lies , whose frown ,	Uneasiness --- Suspense	Suspense
And wrinkled lip , and sneer of cold command ,	Uneasiness --- Suspense	Suspense
Tell that its sculptor well those passions read	Uneasiness --- Suspense	Suspense
Which yet survive , stamped on these lifeless things ,	Uneasiness --- Suspense	Suspense
The hand that mocked them , and the heart that fed :	Uneasiness --- Suspense	Suspense
And on the pedestal these words appear :	Uneasiness --- Suspense	Suspense
? My name is Ozymandias , king of kings :	Uneasiness	Sadness
Look on my works , ye Mighty , and despair !	Uneasiness	Sadness
?	Uneasiness	Sadness
Nothing beside remains .	Sadness	Nostalgia --- Sadness
Round the decay	Sadness	Nostalgia --- Sadness
Of that colossal wreck , boundless and bare	Sadness	Nostalgia --- Sadness
The lone and level sands stretch far away .	Sadness	Nostalgia --- Sadness


Desert Places		

Snow falling and night falling fast, oh, fast	Beauty / Joy	Beauty / Joy
In a field I looked into going past,	Beauty / Joy	Beauty / Joy
And the ground almost covered smooth in snow,	Beauty / Joy	Beauty / Joy
But a few weeds and stubble showing last.	Beauty / Joy	Beauty / Joy

The woods around it have it--it is theirs.	Beauty / Joy	Sadness
All animals are smothered in their lairs.	Beauty / Joy	Sadness
I am too absent-spirited to count;	Sadness	Sadness
The loneliness includes me unawares.	Sadness	Sadness

And lonely as it is that loneliness	Sadness --- Uneasiness	Sadness
Will be more lonely ere it will be less--	Sadness --- Uneasiness	Sadness
A blanker whiteness of benighted snow	Sadness --- Uneasiness	Sadness
